14:42:41.974539 IP 1.1.2.3.33236 > 5.6.7.8.80: Flags [S], seq 3706025649, win 64240, options [mss 1460,sackOK,TS val 2558226367 ecr 0,nop,wscale 7], length 0
14:42:41.975380 IP 5.6.7.8.80 > 1.1.2.3.33236: Flags [S.], seq 2627182731, ack 3706025650, win 65160, options [mss 1460,sackOK,TS val 3289867453 ecr 2558226367,nop,wscale 7], length 0
14:42:41.975397 IP 1.1.2.3.33236 > 5.6.7.8.80: Flags [.], ack 1, win 502, options [nop,nop,TS val 2558226368 ecr 3289867453], length 0
14:42:41.975453 IP 1.1.2.3.33236 > 5.6.7.8.80: Flags [P.], seq 1:82, ack 1, win 502, options [nop,nop,TS val 2558226368 ecr 3289867453], length 81: HTTP: GET /index.html HTTP/1.1
14:42:41.975953 IP 5.6.7.8.80 > 1.1.2.3.33236: Flags [.], ack 82, win 509, options [nop,nop,TS val 3289867454 ecr 2558226368], length 0
14:42:41.976294 IP 5.6.7.8.80 > 1.1.2.3.33236: Flags [P.], seq 1:7241, ack 82, win 509, options [nop,nop,TS val 3289867454 ecr 2558226368], length 7240: HTTP: HTTP/1.1 200 OK
14:42:41.976294 IP 5.6.7.8.80 > 1.1.2.3.33236: Flags [P.], seq 7241:10957, ack 82, win 509, options [nop,nop,TS val 3289867454 ecr 2558226368], length 3716: HTTP
14:42:41.976306 IP 1.1.2.3.33236 > 5.6.7.8.80: Flags [.], ack 7241, win 477, options [nop,nop,TS val 2558226369 ecr 3289867454], length 0
14:42:41.976320 IP 1.1.2.3.33236 > 5.6.7.8.80: Flags [.], ack 10957, win 459, options [nop,nop,TS val 2558226369 ecr 3289867454], length 0
14:42:41.985423 IP 1.1.2.3.33236 > 5.6.7.8.80: Flags [F.], seq 82, ack 10957, win 501, options [nop,nop,TS val 2558226378 ecr 3289867454], length 0
14:42:41.986044 IP 5.6.7.8.80 > 1.1.2.3.33236: Flags [F.], seq 10957, ack 83, win 509, options [nop,nop,TS val 3289867464 ecr 2558226378], length 0
14:42:41.986052 IP 1.1.2.3.33236 > 5.6.7.8.80: Flags [.], ack 10958, win 501, options [nop,nop,TS val 2558226379 ecr 3289867464], length 0
14:42:42.995729 IP 1.1.2.3.33244 > 5.6.7.8.80: Flags [S], seq 1801354321, win 64240, options [mss 1460,sackOK,TS val 2558227388 ecr 0,nop,wscale 7], length 0
14:42:42.996612 IP 5.6.7.8.80 > 1.1.2.3.33244: Flags [S.], seq 3235274634, ack 1801354322, win 65160, options [mss 1460,sackOK,TS val 3289868474 ecr 2558227388,nop,wscale 7], length 0
14:42:42.996635 IP 1.1.2.3.33244 > 5.6.7.8.80: Flags [.], ack 1, win 502, options [nop,nop,TS val 2558227389 ecr 3289868474], length 0
14:42:42.996694 IP 1.1.2.3.33244 > 5.6.7.8.80: Flags [P.], seq 1:82, ack 1, win 502, options [nop,nop,TS val 2558227389 ecr 3289868474], length 81: HTTP: GET /index.html HTTP/1.1
14:42:42.997239 IP 5.6.7.8.80 > 1.1.2.3.33244: Flags [.], ack 82, win 509, options [nop,nop,TS val 3289868475 ecr 2558227389], length 0
14:42:42.997422 IP 5.6.7.8.80 > 1.1.2.3.33244: Flags [P.], seq 1:7241, ack 82, win 509, options [nop,nop,TS val 3289868475 ecr 2558227389], length 7240: HTTP: HTTP/1.1 200 OK
14:42:42.997422 IP 5.6.7.8.80 > 1.1.2.3.33244: Flags [P.], seq 7241:10957, ack 82, win 509, options [nop,nop,TS val 3289868475 ecr 2558227389], length 3716: HTTP
14:42:42.997440 IP 1.1.2.3.33244 > 5.6.7.8.80: Flags [.], ack 7241, win 479, options [nop,nop,TS val 2558227390 ecr 3289868475], length 0
14:42:42.997461 IP 1.1.2.3.33244 > 5.6.7.8.80: Flags [.], ack 10957, win 461, options [nop,nop,TS val 2558227390 ecr 3289868475], length 0
14:42:43.006295 IP 1.1.2.3.33244 > 5.6.7.8.80: Flags [F.], seq 82, ack 10957, win 501, options [nop,nop,TS val 2558227399 ecr 3289868475], length 0
14:42:43.006891 IP 5.6.7.8.80 > 1.1.2.3.33244: Flags [F.], seq 10957, ack 83, win 509, options [nop,nop,TS val 3289868485 ecr 2558227399], length 0
14:42:43.006898 IP 1.1.2.3.33244 > 5.6.7.8.80: Flags [.], ack 10958, win 501, options [nop,nop,TS val 2558227400 ecr 3289868485], length 0
14:42:44.016741 IP 1.1.2.3.33256 > 5.6.7.8.80: Flags [S], seq 3403617524, win 64240, options [mss 1460,sackOK,TS val 2558228409 ecr 0,nop,wscale 7], length 0
14:42:44.017554 IP 5.6.7.8.80 > 1.1.2.3.33256: Flags [S.], seq 723275661, ack 3403617525, win 65160, options [mss 1460,sackOK,TS val 3289869495 ecr 2558228409,nop,wscale 7], length 0
14:42:44.017576 IP 1.1.2.3.33256 > 5.6.7.8.80: Flags [.], ack 1, win 502, options [nop,nop,TS val 2558228410 ecr 3289869495], length 0
14:42:44.017635 IP 1.1.2.3.33256 > 5.6.7.8.80: Flags [P.], seq 1:82, ack 1, win 502, options [nop,nop,TS val 2558228410 ecr 3289869495], length 81: HTTP: GET /index.html HTTP/1.1
14:42:44.018126 IP 5.6.7.8.80 > 1.1.2.3.33256: Flags [.], ack 82, win 509, options [nop,nop,TS val 3289869496 ecr 2558228410], length 0
14:42:44.018326 IP 5.6.7.8.80 > 1.1.2.3.33256: Flags [P.], seq 1:7241, ack 82, win 509, options [nop,nop,TS val 3289869496 ecr 2558228410], length 7240: HTTP: HTTP/1.1 200 OK
14:42:44.018327 IP 5.6.7.8.80 > 1.1.2.3.33256: Flags [P.], seq 7241:10957, ack 82, win 509, options [nop,nop,TS val 3289869496 ecr 2558228410], length 3716: HTTP
14:42:44.018342 IP 1.1.2.3.33256 > 5.6.7.8.80: Flags [.], ack 7241, win 477, options [nop,nop,TS val 2558228411 ecr 3289869496], length 0
14:42:44.018362 IP 1.1.2.3.33256 > 5.6.7.8.80: Flags [.], ack 10957, win 459, options [nop,nop,TS val 2558228411 ecr 3289869496], length 0
14:42:44.027372 IP 1.1.2.3.33256 > 5.6.7.8.80: Flags [F.], seq 82, ack 10957, win 501, options [nop,nop,TS val 2558228420 ecr 3289869496], length 0
14:42:44.028036 IP 5.6.7.8.80 > 1.1.2.3.33256: Flags [F.], seq 10957, ack 83, win 509, options [nop,nop,TS val 3289869506 ecr 2558228420], length 0
14:42:44.028043 IP 1.1.2.3.33256 > 5.6.7.8.80: Flags [.], ack 10958, win 501, options [nop,nop,TS val 2558228421 ecr 3289869506], length 0
14:42:45.037430 IP 1.1.2.3.37958 > 5.6.7.8.80: Flags [S], seq 3955212406, win 64240, options [mss 1460,sackOK,TS val 2558229430 ecr 0,nop,wscale 7], length 0
14:42:45.038355 IP 5.6.7.8.80 > 1.1.2.3.37958: Flags [S.], seq 922032223, ack 3955212407, win 65160, options [mss 1460,sackOK,TS val 3289870516 ecr 2558229430,nop,wscale 7], length 0
14:42:45.038377 IP 1.1.2.3.37958 > 5.6.7.8.80: Flags [.], ack 1, win 502, options [nop,nop,TS val 2558229431 ecr 3289870516], length 0
14:42:45.038435 IP 1.1.2.3.37958 > 5.6.7.8.80: Flags [P.], seq 1:82, ack 1, win 502, options [nop,nop,TS val 2558229431 ecr 3289870516], length 81: HTTP: GET /index.html HTTP/1.1
14:42:45.038776 IP 5.6.7.8.80 > 1.1.2.3.37958: Flags [.], ack 82, win 509, options [nop,nop,TS val 3289870517 ecr 2558229431], length 0
14:42:45.039061 IP 5.6.7.8.80 > 1.1.2.3.37958: Flags [P.], seq 1:7241, ack 82, win 509, options [nop,nop,TS val 3289870517 ecr 2558229431], length 7240: HTTP: HTTP/1.1 200 OK
14:42:45.039061 IP 5.6.7.8.80 > 1.1.2.3.37958: Flags [P.], seq 7241:10957, ack 82, win 509, options [nop,nop,TS val 3289870517 ecr 2558229431], length 3716: HTTP
14:42:45.039073 IP 1.1.2.3.37958 > 5.6.7.8.80: Flags [.], ack 7241, win 479, options [nop,nop,TS val 2558229432 ecr 3289870517], length 0
14:42:45.039088 IP 1.1.2.3.37958 > 5.6.7.8.80: Flags [.], ack 10957, win 461, options [nop,nop,TS val 2558229432 ecr 3289870517], length 0
14:42:45.047588 IP 1.1.2.3.37958 > 5.6.7.8.80: Flags [F.], seq 82, ack 10957, win 501, options [nop,nop,TS val 2558229440 ecr 3289870517], length 0
14:42:45.048220 IP 5.6.7.8.80 > 1.1.2.3.37958: Flags [F.], seq 10957, ack 83, win 509, options [nop,nop,TS val 3289870526 ecr 2558229440], length 0
14:42:45.048227 IP 1.1.2.3.37958 > 5.6.7.8.80: Flags [.], ack 10958, win 501, options [nop,nop,TS val 2558229441 ecr 3289870526], length 0
14:42:46.057646 IP 1.1.2.3.37966 > 5.6.7.8.80: Flags [S], seq 2864295189, win 64240, options [mss 1460,sackOK,TS val 2558230450 ecr 0,nop,wscale 7], length 0
14:42:46.058389 IP 5.6.7.8.80 > 1.1.2.3.37966: Flags [S.], seq 3381521368, ack 2864295190, win 65160, options [mss 1460,sackOK,TS val 3289871536 ecr 2558230450,nop,wscale 7], length 0
14:42:46.058411 IP 1.1.2.3.37966 > 5.6.7.8.80: Flags [.], ack 1, win 502, options [nop,nop,TS val 2558230451 ecr 3289871536], length 0
14:42:46.058469 IP 1.1.2.3.37966 > 5.6.7.8.80: Flags [P.], seq 1:82, ack 1, win 502, options [nop,nop,TS val 2558230451 ecr 3289871536], length 81: HTTP: GET /index.html HTTP/1.1
14:42:46.058828 IP 5.6.7.8.80 > 1.1.2.3.37966: Flags [.], ack 82, win 509, options [nop,nop,TS val 3289871537 ecr 2558230451], length 0
14:42:46.059091 IP 5.6.7.8.80 > 1.1.2.3.37966: Flags [P.], seq 1:7241, ack 82, win 509, options [nop,nop,TS val 3289871537 ecr 2558230451], length 7240: HTTP: HTTP/1.1 200 OK
14:42:46.059091 IP 5.6.7.8.80 > 1.1.2.3.37966: Flags [P.], seq 7241:10957, ack 82, win 509, options [nop,nop,TS val 3289871537 ecr 2558230451], length 3716: HTTP
14:42:46.059102 IP 1.1.2.3.37966 > 5.6.7.8.80: Flags [.], ack 7241, win 479, options [nop,nop,TS val 2558230452 ecr 3289871537], length 0
14:42:46.059116 IP 1.1.2.3.37966 > 5.6.7.8.80: Flags [.], ack 10957, win 461, options [nop,nop,TS val 2558230452 ecr 3289871537], length 0
14:42:46.067998 IP 1.1.2.3.37966 > 5.6.7.8.80: Flags [F.], seq 82, ack 10957, win 501, options [nop,nop,TS val 2558230461 ecr 3289871537], length 0
14:42:46.068620 IP 5.6.7.8.80 > 1.1.2.3.37966: Flags [F.], seq 10957, ack 83, win 509, options [nop,nop,TS val 3289871547 ecr 2558230461], length 0
14:42:46.068628 IP 1.1.2.3.37966 > 5.6.7.8.80: Flags [.], ack 10958, win 501, options [nop,nop,TS val 2558230461 ecr 3289871547], length 0
14:42:47.078554 IP 1.1.2.3.37976 > 5.6.7.8.80: Flags [S], seq 2973190553, win 64240, options [mss 1460,sackOK,TS val 2558231471 ecr 0,nop,wscale 7], length 0
14:42:47.079187 IP 5.6.7.8.80 > 1.1.2.3.37976: Flags [S.], seq 3257863892, ack 2973190554, win 65160, options [mss 1460,sackOK,TS val 3289872557 ecr 2558231471,nop,wscale 7], length 0
14:42:47.079208 IP 1.1.2.3.37976 > 5.6.7.8.80: Flags [.], ack 1, win 502, options [nop,nop,TS val 2558231472 ecr 3289872557], length 0
14:42:47.079265 IP 1.1.2.3.37976 > 5.6.7.8.80: Flags [P.], seq 1:82, ack 1, win 502, options [nop,nop,TS val 2558231472 ecr 3289872557], length 81: HTTP: GET /index.html HTTP/1.1
14:42:47.079609 IP 5.6.7.8.80 > 1.1.2.3.37976: Flags [.], ack 82, win 509, options [nop,nop,TS val 3289872558 ecr 2558231472], length 0
14:42:47.079912 IP 5.6.7.8.80 > 1.1.2.3.37976: Flags [P.], seq 1:7241, ack 82, win 509, options [nop,nop,TS val 3289872558 ecr 2558231472], length 7240: HTTP: HTTP/1.1 200 OK
14:42:47.079912 IP 5.6.7.8.80 > 1.1.2.3.37976: Flags [P.], seq 7241:10957, ack 82, win 509, options [nop,nop,TS val 3289872558 ecr 2558231472], length 3716: HTTP
14:42:47.079924 IP 1.1.2.3.37976 > 5.6.7.8.80: Flags [.], ack 7241, win 479, options [nop,nop,TS val 2558231473 ecr 3289872558], length 0
14:42:47.079940 IP 1.1.2.3.37976 > 5.6.7.8.80: Flags [.], ack 10957, win 461, options [nop,nop,TS val 2558231473 ecr 3289872558], length 0
14:42:47.088805 IP 1.1.2.3.37976 > 5.6.7.8.80: Flags [F.], seq 82, ack 10957, win 501, options [nop,nop,TS val 2558231482 ecr 3289872558], length 0
14:42:47.089444 IP 5.6.7.8.80 > 1.1.2.3.37976: Flags [F.], seq 10957, ack 83, win 509, options [nop,nop,TS val 3289872567 ecr 2558231482], length 0
14:42:47.089452 IP 1.1.2.3.37976 > 5.6.7.8.80: Flags [.], ack 10958, win 501, options [nop,nop,TS val 2558231482 ecr 3289872567], length 0
14:42:48.099043 IP 1.1.2.3.37988 > 5.6.7.8.80: Flags [S], seq 680772058, win 64240, options [mss 1460,sackOK,TS val 2558232492 ecr 0,nop,wscale 7], length 0
14:42:48.099768 IP 5.6.7.8.80 > 1.1.2.3.37988: Flags [S.], seq 713105019, ack 680772059, win 65160, options [mss 1460,sackOK,TS val 3289873578 ecr 2558232492,nop,wscale 7], length 0
14:42:48.099785 IP 1.1.2.3.37988 > 5.6.7.8.80: Flags [.], ack 1, win 502, options [nop,nop,TS val 2558232493 ecr 3289873578], length 0
14:42:48.099873 IP 1.1.2.3.37988 > 5.6.7.8.80: Flags [P.], seq 1:82, ack 1, win 502, options [nop,nop,TS val 2558232493 ecr 3289873578], length 81: HTTP: GET /index.html HTTP/1.1
14:42:48.100347 IP 5.6.7.8.80 > 1.1.2.3.37988: Flags [.], ack 82, win 509, options [nop,nop,TS val 3289873578 ecr 2558232493], length 0
14:42:48.100578 IP 5.6.7.8.80 > 1.1.2.3.37988: Flags [P.], seq 1:7241, ack 82, win 509, options [nop,nop,TS val 3289873578 ecr 2558232493], length 7240: HTTP: HTTP/1.1 200 OK
14:42:48.100578 IP 5.6.7.8.80 > 1.1.2.3.37988: Flags [P.], seq 7241:10957, ack 82, win 509, options [nop,nop,TS val 3289873578 ecr 2558232493], length 3716: HTTP
14:42:48.100598 IP 1.1.2.3.37988 > 5.6.7.8.80: Flags [.], ack 7241, win 479, options [nop,nop,TS val 2558232493 ecr 3289873578], length 0
14:42:48.100620 IP 1.1.2.3.37988 > 5.6.7.8.80: Flags [.], ack 10957, win 461, options [nop,nop,TS val 2558232493 ecr 3289873578], length 0
14:42:48.109516 IP 1.1.2.3.37988 > 5.6.7.8.80: Flags [F.], seq 82, ack 10957, win 501, options [nop,nop,TS val 2558232502 ecr 3289873578], length 0
14:42:48.110579 IP 5.6.7.8.80 > 1.1.2.3.37988: Flags [F.], seq 10957, ack 83, win 509, options [nop,nop,TS val 3289873588 ecr 2558232502], length 0
14:42:48.110588 IP 1.1.2.3.37988 > 5.6.7.8.80: Flags [.], ack 10958, win 501, options [nop,nop,TS val 2558232503 ecr 3289873588], length 0
14:42:49.119386 IP 1.1.2.3.37990 > 5.6.7.8.80: Flags [S], seq 2084040797, win 64240, options [mss 1460,sackOK,TS val 2558233512 ecr 0,nop,wscale 7], length 0
14:42:49.120141 IP 5.6.7.8.80 > 1.1.2.3.37990: Flags [S.], seq 1117727411, ack 2084040798, win 65160, options [mss 1460,sackOK,TS val 3289874598 ecr 2558233512,nop,wscale 7], length 0
14:42:49.120165 IP 1.1.2.3.37990 > 5.6.7.8.80: Flags [.], ack 1, win 502, options [nop,nop,TS val 2558233513 ecr 3289874598], length 0
14:42:49.120245 IP 1.1.2.3.37990 > 5.6.7.8.80: Flags [P.], seq 1:82, ack 1, win 502, options [nop,nop,TS val 2558233513 ecr 3289874598], length 81: HTTP: GET /index.html HTTP/1.1
14:42:49.120839 IP 5.6.7.8.80 > 1.1.2.3.37990: Flags [.], ack 82, win 509, options [nop,nop,TS val 3289874599 ecr 2558233513], length 0
14:42:49.121075 IP 5.6.7.8.80 > 1.1.2.3.37990: Flags [P.], seq 1:7241, ack 82, win 509, options [nop,nop,TS val 3289874599 ecr 2558233513], length 7240: HTTP: HTTP/1.1 200 OK
14:42:49.121075 IP 5.6.7.8.80 > 1.1.2.3.37990: Flags [P.], seq 7241:10957, ack 82, win 509, options [nop,nop,TS val 3289874599 ecr 2558233513], length 3716: HTTP
14:42:49.121094 IP 1.1.2.3.37990 > 5.6.7.8.80: Flags [.], ack 7241, win 479, options [nop,nop,TS val 2558233514 ecr 3289874599], length 0
14:42:49.121116 IP 1.1.2.3.37990 > 5.6.7.8.80: Flags [.], ack 10957, win 459, options [nop,nop,TS val 2558233514 ecr 3289874599], length 0
14:42:49.129933 IP 1.1.2.3.37990 > 5.6.7.8.80: Flags [F.], seq 82, ack 10957, win 501, options [nop,nop,TS val 2558233523 ecr 3289874599], length 0
14:42:49.130600 IP 5.6.7.8.80 > 1.1.2.3.37990: Flags [F.], seq 10957, ack 83, win 509, options [nop,nop,TS val 3289874608 ecr 2558233523], length 0
14:42:49.130608 IP 1.1.2.3.37990 > 5.6.7.8.80: Flags [.], ack 10958, win 501, options [nop,nop,TS val 2558233523 ecr 3289874608], length 0
14:42:50.139793 IP 1.1.2.3.37996 > 5.6.7.8.80: Flags [S], seq 681432810, win 64240, options [mss 1460,sackOK,TS val 2558234533 ecr 0,nop,wscale 7], length 0
14:42:50.140832 IP 5.6.7.8.80 > 1.1.2.3.37996: Flags [S.], seq 3773566776, ack 681432811, win 65160, options [mss 1460,sackOK,TS val 3289875619 ecr 2558234533,nop,wscale 7], length 0
14:42:50.140870 IP 1.1.2.3.37996 > 5.6.7.8.80: Flags [.], ack 1, win 502, options [nop,nop,TS val 2558234534 ecr 3289875619], length 0
14:42:50.140930 IP 1.1.2.3.37996 > 5.6.7.8.80: Flags [P.], seq 1:82, ack 1, win 502, options [nop,nop,TS val 2558234534 ecr 3289875619], length 81: HTTP: GET /index.html HTTP/1.1
14:42:50.141486 IP 5.6.7.8.80 > 1.1.2.3.37996: Flags [.], ack 82, win 509, options [nop,nop,TS val 3289875619 ecr 2558234534], length 0
14:42:50.141725 IP 5.6.7.8.80 > 1.1.2.3.37996: Flags [P.], seq 1:7241, ack 82, win 509, options [nop,nop,TS val 3289875620 ecr 2558234534], length 7240: HTTP: HTTP/1.1 200 OK
14:42:50.141725 IP 5.6.7.8.80 > 1.1.2.3.37996: Flags [P.], seq 7241:10957, ack 82, win 509, options [nop,nop,TS val 3289875620 ecr 2558234534], length 3716: HTTP
14:42:50.141744 IP 1.1.2.3.37996 > 5.6.7.8.80: Flags [.], ack 7241, win 479, options [nop,nop,TS val 2558234534 ecr 3289875620], length 0
14:42:50.141766 IP 1.1.2.3.37996 > 5.6.7.8.80: Flags [.], ack 10957, win 461, options [nop,nop,TS val 2558234535 ecr 3289875620], length 0
14:42:50.150501 IP 1.1.2.3.37996 > 5.6.7.8.80: Flags [F.], seq 82, ack 10957, win 501, options [nop,nop,TS val 2558234543 ecr 3289875620], length 0
14:42:50.151188 IP 5.6.7.8.80 > 1.1.2.3.37996: Flags [F.], seq 10957, ack 83, win 509, options [nop,nop,TS val 3289875629 ecr 2558234543], length 0
14:42:50.151196 IP 1.1.2.3.37996 > 5.6.7.8.80: Flags [.], ack 10958, win 501, options [nop,nop,TS val 2558234544 ecr 3289875629], length 0
14:42:51.160368 IP 1.1.2.3.38002 > 5.6.7.8.80: Flags [S], seq 3957325507, win 64240, options [mss 1460,sackOK,TS val 2558235553 ecr 0,nop,wscale 7], length 0
14:42:51.161419 IP 5.6.7.8.80 > 1.1.2.3.38002: Flags [S.], seq 566383859, ack 3957325508, win 65160, options [mss 1460,sackOK,TS val 3289876639 ecr 2558235553,nop,wscale 7], length 0
14:42:51.161441 IP 1.1.2.3.38002 > 5.6.7.8.80: Flags [.], ack 1, win 502, options [nop,nop,TS val 2558235554 ecr 3289876639], length 0
14:42:51.161502 IP 1.1.2.3.38002 > 5.6.7.8.80: Flags [P.], seq 1:82, ack 1, win 502, options [nop,nop,TS val 2558235554 ecr 3289876639], length 81: HTTP: GET /index.html HTTP/1.1
14:42:51.162022 IP 5.6.7.8.80 > 1.1.2.3.38002: Flags [.], ack 82, win 509, options [nop,nop,TS val 3289876640 ecr 2558235554], length 0
14:42:51.162225 IP 5.6.7.8.80 > 1.1.2.3.38002: Flags [P.], seq 1:7241, ack 82, win 509, options [nop,nop,TS val 3289876640 ecr 2558235554], length 7240: HTTP: HTTP/1.1 200 OK
14:42:51.162225 IP 5.6.7.8.80 > 1.1.2.3.38002: Flags [P.], seq 7241:10957, ack 82, win 509, options [nop,nop,TS val 3289876640 ecr 2558235554], length 3716: HTTP
14:42:51.162241 IP 1.1.2.3.38002 > 5.6.7.8.80: Flags [.], ack 7241, win 479, options [nop,nop,TS val 2558235555 ecr 3289876640], length 0
14:42:51.162261 IP 1.1.2.3.38002 > 5.6.7.8.80: Flags [.], ack 10957, win 459, options [nop,nop,TS val 2558235555 ecr 3289876640], length 0
14:42:51.171183 IP 1.1.2.3.38002 > 5.6.7.8.80: Flags [F.], seq 82, ack 10957, win 501, options [nop,nop,TS val 2558235564 ecr 3289876640], length 0
14:42:51.171829 IP 5.6.7.8.80 > 1.1.2.3.38002: Flags [F.], seq 10957, ack 83, win 509, options [nop,nop,TS val 3289876650 ecr 2558235564], length 0
14:42:51.171837 IP 1.1.2.3.38002 > 5.6.7.8.80: Flags [.], ack 10958, win 501, options [nop,nop,TS val 2558235565 ecr 3289876650], length 0
14:42:52.181005 IP 1.1.2.3.38004 > 5.6.7.8.80: Flags [S], seq 4206727761, win 64240, options [mss 1460,sackOK,TS val 2558236574 ecr 0,nop,wscale 7], length 0
14:42:52.181808 IP 5.6.7.8.80 > 1.1.2.3.38004: Flags [S.], seq 1254561562, ack 4206727762, win 65160, options [mss 1460,sackOK,TS val 3289877660 ecr 2558236574,nop,wscale 7], length 0
14:42:52.181830 IP 1.1.2.3.38004 > 5.6.7.8.80: Flags [.], ack 1, win 502, options [nop,nop,TS val 2558236575 ecr 3289877660], length 0
14:42:52.181913 IP 1.1.2.3.38004 > 5.6.7.8.80: Flags [P.], seq 1:82, ack 1, win 502, options [nop,nop,TS val 2558236575 ecr 3289877660], length 81: HTTP: GET /index.html HTTP/1.1
14:42:52.182410 IP 5.6.7.8.80 > 1.1.2.3.38004: Flags [.], ack 82, win 509, options [nop,nop,TS val 3289877660 ecr 2558236575], length 0
14:42:52.182595 IP 5.6.7.8.80 > 1.1.2.3.38004: Flags [P.], seq 1:7241, ack 82, win 509, options [nop,nop,TS val 3289877660 ecr 2558236575], length 7240: HTTP: HTTP/1.1 200 OK
14:42:52.182595 IP 5.6.7.8.80 > 1.1.2.3.38004: Flags [P.], seq 7241:10957, ack 82, win 509, options [nop,nop,TS val 3289877660 ecr 2558236575], length 3716: HTTP
14:42:52.182611 IP 1.1.2.3.38004 > 5.6.7.8.80: Flags [.], ack 7241, win 479, options [nop,nop,TS val 2558236575 ecr 3289877660], length 0
14:42:52.182631 IP 1.1.2.3.38004 > 5.6.7.8.80: Flags [.], ack 10957, win 461, options [nop,nop,TS val 2558236575 ecr 3289877660], length 0
14:42:52.191127 IP 1.1.2.3.38004 > 5.6.7.8.80: Flags [F.], seq 82, ack 10957, win 501, options [nop,nop,TS val 2558236584 ecr 3289877660], length 0
14:42:52.191777 IP 5.6.7.8.80 > 1.1.2.3.38004: Flags [F.], seq 10957, ack 83, win 509, options [nop,nop,TS val 3289877670 ecr 2558236584], length 0
14:42:52.191785 IP 1.1.2.3.38004 > 5.6.7.8.80: Flags [.], ack 10958, win 501, options [nop,nop,TS val 2558236585 ecr 3289877670], length 0
14:42:53.201016 IP 1.1.2.3.38014 > 5.6.7.8.80: Flags [S], seq 38163658, win 64240, options [mss 1460,sackOK,TS val 2558237594 ecr 0,nop,wscale 7], length 0
14:42:53.201662 IP 5.6.7.8.80 > 1.1.2.3.38014: Flags [S.], seq 1494654766, ack 38163659, win 65160, options [mss 1460,sackOK,TS val 3289878680 ecr 2558237594,nop,wscale 7], length 0
14:42:53.201685 IP 1.1.2.3.38014 > 5.6.7.8.80: Flags [.], ack 1, win 502, options [nop,nop,TS val 2558237594 ecr 3289878680], length 0
14:42:53.201744 IP 1.1.2.3.38014 > 5.6.7.8.80: Flags [P.], seq 1:82, ack 1, win 502, options [nop,nop,TS val 2558237594 ecr 3289878680], length 81: HTTP: GET /index.html HTTP/1.1
14:42:53.202233 IP 5.6.7.8.80 > 1.1.2.3.38014: Flags [.], ack 82, win 509, options [nop,nop,TS val 3289878680 ecr 2558237594], length 0
14:42:53.202467 IP 5.6.7.8.80 > 1.1.2.3.38014: Flags [P.], seq 1:7241, ack 82, win 509, options [nop,nop,TS val 3289878680 ecr 2558237594], length 7240: HTTP: HTTP/1.1 200 OK
14:42:53.202467 IP 5.6.7.8.80 > 1.1.2.3.38014: Flags [P.], seq 7241:10957, ack 82, win 509, options [nop,nop,TS val 3289878680 ecr 2558237594], length 3716: HTTP
14:42:53.202483 IP 1.1.2.3.38014 > 5.6.7.8.80: Flags [.], ack 7241, win 479, options [nop,nop,TS val 2558237595 ecr 3289878680], length 0
14:42:53.202504 IP 1.1.2.3.38014 > 5.6.7.8.80: Flags [.], ack 10957, win 459, options [nop,nop,TS val 2558237595 ecr 3289878680], length 0
14:42:53.211463 IP 1.1.2.3.38014 > 5.6.7.8.80: Flags [F.], seq 82, ack 10957, win 501, options [nop,nop,TS val 2558237604 ecr 3289878680], length 0
14:42:53.212169 IP 5.6.7.8.80 > 1.1.2.3.38014: Flags [F.], seq 10957, ack 83, win 509, options [nop,nop,TS val 3289878690 ecr 2558237604], length 0
14:42:53.212177 IP 1.1.2.3.38014 > 5.6.7.8.80: Flags [.], ack 10958, win 501, options [nop,nop,TS val 2558237605 ecr 3289878690], length 0
14:42:54.221345 IP 1.1.2.3.38026 > 5.6.7.8.80: Flags [S], seq 1844249493, win 64240, options [mss 1460,sackOK,TS val 2558238614 ecr 0,nop,wscale 7], length 0
14:42:54.222247 IP 5.6.7.8.80 > 1.1.2.3.38026: Flags [S.], seq 2275592908, ack 1844249494, win 65160, options [mss 1460,sackOK,TS val 3289879700 ecr 2558238614,nop,wscale 7], length 0
14:42:54.222269 IP 1.1.2.3.38026 > 5.6.7.8.80: Flags [.], ack 1, win 502, options [nop,nop,TS val 2558238615 ecr 3289879700], length 0
14:42:54.222329 IP 1.1.2.3.38026 > 5.6.7.8.80: Flags [P.], seq 1:82, ack 1, win 502, options [nop,nop,TS val 2558238615 ecr 3289879700], length 81: HTTP: GET /index.html HTTP/1.1
14:42:54.222723 IP 5.6.7.8.80 > 1.1.2.3.38026: Flags [.], ack 82, win 509, options [nop,nop,TS val 3289879701 ecr 2558238615], length 0
14:42:54.222970 IP 5.6.7.8.80 > 1.1.2.3.38026: Flags [P.], seq 1:7241, ack 82, win 509, options [nop,nop,TS val 3289879701 ecr 2558238615], length 7240: HTTP: HTTP/1.1 200 OK
14:42:54.222970 IP 5.6.7.8.80 > 1.1.2.3.38026: Flags [P.], seq 7241:10957, ack 82, win 509, options [nop,nop,TS val 3289879701 ecr 2558238615], length 3716: HTTP
14:42:54.222981 IP 1.1.2.3.38026 > 5.6.7.8.80: Flags [.], ack 7241, win 479, options [nop,nop,TS val 2558238616 ecr 3289879701], length 0
14:42:54.222996 IP 1.1.2.3.38026 > 5.6.7.8.80: Flags [.], ack 10957, win 461, options [nop,nop,TS val 2558238616 ecr 3289879701], length 0
14:42:54.231728 IP 1.1.2.3.38026 > 5.6.7.8.80: Flags [F.], seq 82, ack 10957, win 501, options [nop,nop,TS val 2558238624 ecr 3289879701], length 0
14:42:54.232404 IP 5.6.7.8.80 > 1.1.2.3.38026: Flags [F.], seq 10957, ack 83, win 509, options [nop,nop,TS val 3289879710 ecr 2558238624], length 0
14:42:54.232413 IP 1.1.2.3.38026 > 5.6.7.8.80: Flags [.], ack 10958, win 501, options [nop,nop,TS val 2558238625 ecr 3289879710], length 0
14:42:55.241489 IP 1.1.2.3.52116 > 5.6.7.8.80: Flags [S], seq 958084215, win 64240, options [mss 1460,sackOK,TS val 2558239634 ecr 0,nop,wscale 7], length 0
14:42:55.242409 IP 5.6.7.8.80 > 1.1.2.3.52116: Flags [S.], seq 2940603824, ack 958084216, win 65160, options [mss 1460,sackOK,TS val 3289880720 ecr 2558239634,nop,wscale 7], length 0
14:42:55.242432 IP 1.1.2.3.52116 > 5.6.7.8.80: Flags [.], ack 1, win 502, options [nop,nop,TS val 2558239635 ecr 3289880720], length 0
14:42:55.242491 IP 1.1.2.3.52116 > 5.6.7.8.80: Flags [P.], seq 1:82, ack 1, win 502, options [nop,nop,TS val 2558239635 ecr 3289880720], length 81: HTTP: GET /index.html HTTP/1.1
14:42:55.242890 IP 5.6.7.8.80 > 1.1.2.3.52116: Flags [.], ack 82, win 509, options [nop,nop,TS val 3289880721 ecr 2558239635], length 0
14:42:55.243146 IP 5.6.7.8.80 > 1.1.2.3.52116: Flags [P.], seq 1:7241, ack 82, win 509, options [nop,nop,TS val 3289880721 ecr 2558239635], length 7240: HTTP: HTTP/1.1 200 OK
14:42:55.243146 IP 5.6.7.8.80 > 1.1.2.3.52116: Flags [P.], seq 7241:10957, ack 82, win 509, options [nop,nop,TS val 3289880721 ecr 2558239635], length 3716: HTTP
14:42:55.243157 IP 1.1.2.3.52116 > 5.6.7.8.80: Flags [.], ack 7241, win 477, options [nop,nop,TS val 2558239636 ecr 3289880721], length 0
14:42:55.243172 IP 1.1.2.3.52116 > 5.6.7.8.80: Flags [.], ack 10957, win 459, options [nop,nop,TS val 2558239636 ecr 3289880721], length 0
14:42:55.252231 IP 1.1.2.3.52116 > 5.6.7.8.80: Flags [F.], seq 82, ack 10957, win 501, options [nop,nop,TS val 2558239645 ecr 3289880721], length 0
14:42:55.252922 IP 5.6.7.8.80 > 1.1.2.3.52116: Flags [F.], seq 10957, ack 83, win 509, options [nop,nop,TS val 3289880731 ecr 2558239645], length 0
14:42:55.252930 IP 1.1.2.3.52116 > 5.6.7.8.80: Flags [.], ack 10958, win 501, options [nop,nop,TS val 2558239646 ecr 3289880731], length 0
14:42:56.262075 IP 1.1.2.3.52124 > 5.6.7.8.80: Flags [S], seq 1541677042, win 64240, options [mss 1460,sackOK,TS val 2558240655 ecr 0,nop,wscale 7], length 0
14:42:56.263052 IP 5.6.7.8.80 > 1.1.2.3.52124: Flags [S.], seq 1563447885, ack 1541677043, win 65160, options [mss 1460,sackOK,TS val 3289881741 ecr 2558240655,nop,wscale 7], length 0
14:42:56.263073 IP 1.1.2.3.52124 > 5.6.7.8.80: Flags [.], ack 1, win 502, options [nop,nop,TS val 2558240656 ecr 3289881741], length 0
14:42:56.263141 IP 1.1.2.3.52124 > 5.6.7.8.80: Flags [P.], seq 1:82, ack 1, win 502, options [nop,nop,TS val 2558240656 ecr 3289881741], length 81: HTTP: GET /index.html HTTP/1.1
14:42:56.263499 IP 5.6.7.8.80 > 1.1.2.3.52124: Flags [.], ack 82, win 509, options [nop,nop,TS val 3289881741 ecr 2558240656], length 0
14:42:56.263808 IP 5.6.7.8.80 > 1.1.2.3.52124: Flags [P.], seq 1:7241, ack 82, win 509, options [nop,nop,TS val 3289881742 ecr 2558240656], length 7240: HTTP: HTTP/1.1 200 OK
14:42:56.263808 IP 5.6.7.8.80 > 1.1.2.3.52124: Flags [P.], seq 7241:10957, ack 82, win 509, options [nop,nop,TS val 3289881742 ecr 2558240656], length 3716: HTTP
14:42:56.263820 IP 1.1.2.3.52124 > 5.6.7.8.80: Flags [.], ack 7241, win 479, options [nop,nop,TS val 2558240657 ecr 3289881742], length 0
14:42:56.263834 IP 1.1.2.3.52124 > 5.6.7.8.80: Flags [.], ack 10957, win 461, options [nop,nop,TS val 2558240657 ecr 3289881742], length 0
14:42:56.273029 IP 1.1.2.3.52124 > 5.6.7.8.80: Flags [F.], seq 82, ack 10957, win 501, options [nop,nop,TS val 2558240666 ecr 3289881742], length 0
14:42:56.273705 IP 5.6.7.8.80 > 1.1.2.3.52124: Flags [F.], seq 10957, ack 83, win 509, options [nop,nop,TS val 3289881752 ecr 2558240666], length 0
14:42:56.273713 IP 1.1.2.3.52124 > 5.6.7.8.80: Flags [.], ack 10958, win 501, options [nop,nop,TS val 2558240666 ecr 3289881752], length 0
14:42:57.282804 IP 1.1.2.3.52134 > 5.6.7.8.80: Flags [S], seq 3740111348, win 64240, options [mss 1460,sackOK,TS val 2558241676 ecr 0,nop,wscale 7], length 0
14:42:57.283810 IP 5.6.7.8.80 > 1.1.2.3.52134: Flags [S.], seq 1398900008, ack 3740111349, win 65160, options [mss 1460,sackOK,TS val 3289882762 ecr 2558241676,nop,wscale 7], length 0
14:42:57.283827 IP 1.1.2.3.52134 > 5.6.7.8.80: Flags [.], ack 1, win 502, options [nop,nop,TS val 2558241677 ecr 3289882762], length 0
14:42:57.283896 IP 1.1.2.3.52134 > 5.6.7.8.80: Flags [P.], seq 1:82, ack 1, win 502, options [nop,nop,TS val 2558241677 ecr 3289882762], length 81: HTTP: GET /index.html HTTP/1.1
14:42:57.284371 IP 5.6.7.8.80 > 1.1.2.3.52134: Flags [.], ack 82, win 509, options [nop,nop,TS val 3289882762 ecr 2558241677], length 0
14:42:57.284599 IP 5.6.7.8.80 > 1.1.2.3.52134: Flags [P.], seq 1:7241, ack 82, win 509, options [nop,nop,TS val 3289882762 ecr 2558241677], length 7240: HTTP: HTTP/1.1 200 OK
14:42:57.284599 IP 5.6.7.8.80 > 1.1.2.3.52134: Flags [P.], seq 7241:10957, ack 82, win 509, options [nop,nop,TS val 3289882762 ecr 2558241677], length 3716: HTTP
14:42:57.284619 IP 1.1.2.3.52134 > 5.6.7.8.80: Flags [.], ack 7241, win 477, options [nop,nop,TS val 2558241677 ecr 3289882762], length 0
14:42:57.284639 IP 1.1.2.3.52134 > 5.6.7.8.80: Flags [.], ack 10957, win 459, options [nop,nop,TS val 2558241677 ecr 3289882762], length 0
14:42:57.293477 IP 1.1.2.3.52134 > 5.6.7.8.80: Flags [F.], seq 82, ack 10957, win 501, options [nop,nop,TS val 2558241686 ecr 3289882762], length 0
14:42:57.294180 IP 5.6.7.8.80 > 1.1.2.3.52134: Flags [F.], seq 10957, ack 83, win 509, options [nop,nop,TS val 3289882772 ecr 2558241686], length 0
14:42:57.294188 IP 1.1.2.3.52134 > 5.6.7.8.80: Flags [.], ack 10958, win 501, options [nop,nop,TS val 2558241687 ecr 3289882772], length 0
14:42:58.303390 IP 1.1.2.3.52142 > 5.6.7.8.80: Flags [S], seq 3442053586, win 64240, options [mss 1460,sackOK,TS val 2558242696 ecr 0,nop,wscale 7], length 0
14:42:58.304333 IP 5.6.7.8.80 > 1.1.2.3.52142: Flags [S.], seq 630308651, ack 3442053587, win 65160, options [mss 1460,sackOK,TS val 3289883782 ecr 2558242696,nop,wscale 7], length 0
14:42:58.304354 IP 1.1.2.3.52142 > 5.6.7.8.80: Flags [.], ack 1, win 502, options [nop,nop,TS val 2558242697 ecr 3289883782], length 0
14:42:58.304415 IP 1.1.2.3.52142 > 5.6.7.8.80: Flags [P.], seq 1:82, ack 1, win 502, options [nop,nop,TS val 2558242697 ecr 3289883782], length 81: HTTP: GET /index.html HTTP/1.1
14:42:58.305034 IP 5.6.7.8.80 > 1.1.2.3.52142: Flags [.], ack 82, win 509, options [nop,nop,TS val 3289883783 ecr 2558242697], length 0
14:42:58.305289 IP 5.6.7.8.80 > 1.1.2.3.52142: Flags [P.], seq 1:7241, ack 82, win 509, options [nop,nop,TS val 3289883783 ecr 2558242697], length 7240: HTTP: HTTP/1.1 200 OK
14:42:58.305289 IP 5.6.7.8.80 > 1.1.2.3.52142: Flags [P.], seq 7241:10957, ack 82, win 509, options [nop,nop,TS val 3289883783 ecr 2558242697], length 3716: HTTP
14:42:58.305308 IP 1.1.2.3.52142 > 5.6.7.8.80: Flags [.], ack 7241, win 479, options [nop,nop,TS val 2558242698 ecr 3289883783], length 0
14:42:58.305330 IP 1.1.2.3.52142 > 5.6.7.8.80: Flags [.], ack 10957, win 461, options [nop,nop,TS val 2558242698 ecr 3289883783], length 0
14:42:58.313685 IP 1.1.2.3.52142 > 5.6.7.8.80: Flags [F.], seq 82, ack 10957, win 501, options [nop,nop,TS val 2558242706 ecr 3289883783], length 0
14:42:58.314378 IP 5.6.7.8.80 > 1.1.2.3.52142: Flags [F.], seq 10957, ack 83, win 509, options [nop,nop,TS val 3289883792 ecr 2558242706], length 0
14:42:58.314386 IP 1.1.2.3.52142 > 5.6.7.8.80: Flags [.], ack 10958, win 501, options [nop,nop,TS val 2558242707 ecr 3289883792], length 0
14:42:59.323464 IP 1.1.2.3.52150 > 5.6.7.8.80: Flags [S], seq 1596615968, win 64240, options [mss 1460,sackOK,TS val 2558243716 ecr 0,nop,wscale 7], length 0
14:42:59.324537 IP 5.6.7.8.80 > 1.1.2.3.52150: Flags [S.], seq 1787335996, ack 1596615969, win 65160, options [mss 1460,sackOK,TS val 3289884802 ecr 2558243716,nop,wscale 7], length 0
14:42:59.324560 IP 1.1.2.3.52150 > 5.6.7.8.80: Flags [.], ack 1, win 502, options [nop,nop,TS val 2558243717 ecr 3289884802], length 0
14:42:59.324620 IP 1.1.2.3.52150 > 5.6.7.8.80: Flags [P.], seq 1:82, ack 1, win 502, options [nop,nop,TS val 2558243717 ecr 3289884802], length 81: HTTP: GET /index.html HTTP/1.1
14:42:59.325227 IP 5.6.7.8.80 > 1.1.2.3.52150: Flags [.], ack 82, win 509, options [nop,nop,TS val 3289884803 ecr 2558243717], length 0
14:42:59.325475 IP 5.6.7.8.80 > 1.1.2.3.52150: Flags [P.], seq 1:7241, ack 82, win 509, options [nop,nop,TS val 3289884803 ecr 2558243717], length 7240: HTTP: HTTP/1.1 200 OK
14:42:59.325475 IP 5.6.7.8.80 > 1.1.2.3.52150: Flags [P.], seq 7241:10957, ack 82, win 509, options [nop,nop,TS val 3289884803 ecr 2558243717], length 3716: HTTP
14:42:59.325495 IP 1.1.2.3.52150 > 5.6.7.8.80: Flags [.], ack 7241, win 477, options [nop,nop,TS val 2558243718 ecr 3289884803], length 0
14:42:59.325516 IP 1.1.2.3.52150 > 5.6.7.8.80: Flags [.], ack 10957, win 459, options [nop,nop,TS val 2558243718 ecr 3289884803], length 0
14:42:59.334230 IP 1.1.2.3.52150 > 5.6.7.8.80: Flags [F.], seq 82, ack 10957, win 501, options [nop,nop,TS val 2558243727 ecr 3289884803], length 0
14:42:59.334887 IP 5.6.7.8.80 > 1.1.2.3.52150: Flags [F.], seq 10957, ack 83, win 509, options [nop,nop,TS val 3289884813 ecr 2558243727], length 0
14:42:59.334896 IP 1.1.2.3.52150 > 5.6.7.8.80: Flags [.], ack 10958, win 501, options [nop,nop,TS val 2558243728 ecr 3289884813], length 0
14:43:00.344034 IP 1.1.2.3.52164 > 5.6.7.8.80: Flags [S], seq 1893523189, win 64240, options [mss 1460,sackOK,TS val 2558244737 ecr 0,nop,wscale 7], length 0
14:43:00.344871 IP 5.6.7.8.80 > 1.1.2.3.52164: Flags [S.], seq 1108718809, ack 1893523190, win 65160, options [mss 1460,sackOK,TS val 3289885823 ecr 2558244737,nop,wscale 7], length 0
14:43:00.344893 IP 1.1.2.3.52164 > 5.6.7.8.80: Flags [.], ack 1, win 502, options [nop,nop,TS val 2558244738 ecr 3289885823], length 0
14:43:00.344954 IP 1.1.2.3.52164 > 5.6.7.8.80: Flags [P.], seq 1:82, ack 1, win 502, options [nop,nop,TS val 2558244738 ecr 3289885823], length 81: HTTP: GET /index.html HTTP/1.1
14:43:00.345527 IP 5.6.7.8.80 > 1.1.2.3.52164: Flags [.], ack 82, win 509, options [nop,nop,TS val 3289885823 ecr 2558244738], length 0
14:43:00.345747 IP 5.6.7.8.80 > 1.1.2.3.52164: Flags [P.], seq 1:7241, ack 82, win 509, options [nop,nop,TS val 3289885824 ecr 2558244738], length 7240: HTTP: HTTP/1.1 200 OK
14:43:00.345747 IP 5.6.7.8.80 > 1.1.2.3.52164: Flags [P.], seq 7241:10957, ack 82, win 509, options [nop,nop,TS val 3289885824 ecr 2558244738], length 3716: HTTP
14:43:00.345767 IP 1.1.2.3.52164 > 5.6.7.8.80: Flags [.], ack 7241, win 479, options [nop,nop,TS val 2558244739 ecr 3289885824], length 0
14:43:00.345788 IP 1.1.2.3.52164 > 5.6.7.8.80: Flags [.], ack 10957, win 461, options [nop,nop,TS val 2558244739 ecr 3289885824], length 0
14:43:00.354136 IP 1.1.2.3.52164 > 5.6.7.8.80: Flags [F.], seq 82, ack 10957, win 501, options [nop,nop,TS val 2558244747 ecr 3289885824], length 0
14:43:00.354818 IP 5.6.7.8.80 > 1.1.2.3.52164: Flags [F.], seq 10957, ack 83, win 509, options [nop,nop,TS val 3289885833 ecr 2558244747], length 0
14:43:00.354826 IP 1.1.2.3.52164 > 5.6.7.8.80: Flags [.], ack 10958, win 501, options [nop,nop,TS val 2558244748 ecr 3289885833], length 0
14:43:01.364002 IP 1.1.2.3.52168 > 5.6.7.8.80: Flags [S], seq 297026807, win 64240, options [mss 1460,sackOK,TS val 2558245757 ecr 0,nop,wscale 7], length 0
14:43:01.364891 IP 5.6.7.8.80 > 1.1.2.3.52168: Flags [S.], seq 3928522319, ack 297026808, win 65160, options [mss 1460,sackOK,TS val 3289886843 ecr 2558245757,nop,wscale 7], length 0
14:43:01.364916 IP 1.1.2.3.52168 > 5.6.7.8.80: Flags [.], ack 1, win 502, options [nop,nop,TS val 2558245758 ecr 3289886843], length 0
14:43:01.364977 IP 1.1.2.3.52168 > 5.6.7.8.80: Flags [P.], seq 1:82, ack 1, win 502, options [nop,nop,TS val 2558245758 ecr 3289886843], length 81: HTTP: GET /index.html HTTP/1.1
14:43:01.365533 IP 5.6.7.8.80 > 1.1.2.3.52168: Flags [.], ack 82, win 509, options [nop,nop,TS val 3289886843 ecr 2558245758], length 0
14:43:01.365758 IP 5.6.7.8.80 > 1.1.2.3.52168: Flags [P.], seq 1:7241, ack 82, win 509, options [nop,nop,TS val 3289886844 ecr 2558245758], length 7240: HTTP: HTTP/1.1 200 OK
14:43:01.365758 IP 5.6.7.8.80 > 1.1.2.3.52168: Flags [P.], seq 7241:10957, ack 82, win 509, options [nop,nop,TS val 3289886844 ecr 2558245758], length 3716: HTTP
14:43:01.365778 IP 1.1.2.3.52168 > 5.6.7.8.80: Flags [.], ack 7241, win 477, options [nop,nop,TS val 2558245759 ecr 3289886844], length 0
14:43:01.365800 IP 1.1.2.3.52168 > 5.6.7.8.80: Flags [.], ack 10957, win 459, options [nop,nop,TS val 2558245759 ecr 3289886844], length 0
14:43:01.374561 IP 1.1.2.3.52168 > 5.6.7.8.80: Flags [F.], seq 82, ack 10957, win 501, options [nop,nop,TS val 2558245767 ecr 3289886844], length 0
14:43:01.375261 IP 5.6.7.8.80 > 1.1.2.3.52168: Flags [F.], seq 10957, ack 83, win 509, options [nop,nop,TS val 3289886853 ecr 2558245767], length 0
14:43:01.375269 IP 1.1.2.3.52168 > 5.6.7.8.80: Flags [.], ack 10958, win 501, options [nop,nop,TS val 2558245768 ecr 3289886853], length 0
14:43:02.384386 IP 1.1.2.3.52172 > 5.6.7.8.80: Flags [S], seq 2068937033, win 64240, options [mss 1460,sackOK,TS val 2558246777 ecr 0,nop,wscale 7], length 0
14:43:02.385215 IP 5.6.7.8.80 > 1.1.2.3.52172: Flags [S.], seq 14246463, ack 2068937034, win 65160, options [mss 1460,sackOK,TS val 3289887863 ecr 2558246777,nop,wscale 7], length 0
14:43:02.385237 IP 1.1.2.3.52172 > 5.6.7.8.80: Flags [.], ack 1, win 502, options [nop,nop,TS val 2558246778 ecr 3289887863], length 0
14:43:02.385297 IP 1.1.2.3.52172 > 5.6.7.8.80: Flags [P.], seq 1:82, ack 1, win 502, options [nop,nop,TS val 2558246778 ecr 3289887863], length 81: HTTP: GET /index.html HTTP/1.1
14:43:02.385807 IP 5.6.7.8.80 > 1.1.2.3.52172: Flags [.], ack 82, win 509, options [nop,nop,TS val 3289887864 ecr 2558246778], length 0
14:43:02.386072 IP 5.6.7.8.80 > 1.1.2.3.52172: Flags [P.], seq 1:7241, ack 82, win 509, options [nop,nop,TS val 3289887864 ecr 2558246778], length 7240: HTTP: HTTP/1.1 200 OK
14:43:02.386073 IP 5.6.7.8.80 > 1.1.2.3.52172: Flags [P.], seq 7241:10957, ack 82, win 509, options [nop,nop,TS val 3289887864 ecr 2558246778], length 3716: HTTP
14:43:02.386092 IP 1.1.2.3.52172 > 5.6.7.8.80: Flags [.], ack 7241, win 479, options [nop,nop,TS val 2558246779 ecr 3289887864], length 0
14:43:02.386113 IP 1.1.2.3.52172 > 5.6.7.8.80: Flags [.], ack 10957, win 461, options [nop,nop,TS val 2558246779 ecr 3289887864], length 0
14:43:02.394954 IP 1.1.2.3.52172 > 5.6.7.8.80: Flags [F.], seq 82, ack 10957, win 501, options [nop,nop,TS val 2558246788 ecr 3289887864], length 0
14:43:02.395618 IP 5.6.7.8.80 > 1.1.2.3.52172: Flags [F.], seq 10957, ack 83, win 509, options [nop,nop,TS val 3289887873 ecr 2558246788], length 0
14:43:02.395626 IP 1.1.2.3.52172 > 5.6.7.8.80: Flags [.], ack 10958, win 501, options [nop,nop,TS val 2558246788 ecr 3289887873], length 0
14:43:03.404800 IP 1.1.2.3.52176 > 5.6.7.8.80: Flags [S], seq 2975762892, win 64240, options [mss 1460,sackOK,TS val 2558247798 ecr 0,nop,wscale 7], length 0
14:43:03.405978 IP 5.6.7.8.80 > 1.1.2.3.52176: Flags [S.], seq 3369303352, ack 2975762893, win 65160, options [mss 1460,sackOK,TS val 3289888884 ecr 2558247798,nop,wscale 7], length 0
14:43:03.406000 IP 1.1.2.3.52176 > 5.6.7.8.80: Flags [.], ack 1, win 502, options [nop,nop,TS val 2558247799 ecr 3289888884], length 0
14:43:03.406060 IP 1.1.2.3.52176 > 5.6.7.8.80: Flags [P.], seq 1:82, ack 1, win 502, options [nop,nop,TS val 2558247799 ecr 3289888884], length 81: HTTP: GET /index.html HTTP/1.1
14:43:03.406576 IP 5.6.7.8.80 > 1.1.2.3.52176: Flags [.], ack 82, win 509, options [nop,nop,TS val 3289888884 ecr 2558247799], length 0
14:43:03.406768 IP 5.6.7.8.80 > 1.1.2.3.52176: Flags [P.], seq 1:7241, ack 82, win 509, options [nop,nop,TS val 3289888885 ecr 2558247799], length 7240: HTTP: HTTP/1.1 200 OK
14:43:03.406769 IP 5.6.7.8.80 > 1.1.2.3.52176: Flags [P.], seq 7241:10957, ack 82, win 509, options [nop,nop,TS val 3289888885 ecr 2558247799], length 3716: HTTP
14:43:03.406785 IP 1.1.2.3.52176 > 5.6.7.8.80: Flags [.], ack 7241, win 477, options [nop,nop,TS val 2558247800 ecr 3289888885], length 0
